カテゴリ,用語,説明
基本概念,ソースコード,人間がプログラミング言語で書いたテキスト形式の設計図。
基本概念,アルゴリズム,問題を解決するための手順や計算の手順。
基本概念,コンパイル,ソースコードをコンピュータが実行可能な形式に一括変換すること。
基本概念,ビルド,コンパイルやライブラリの結合を行い、実行可能なファイルを作ること。
基本概念,インタプリタ,コードを1行ずつ読み込みながら即座に実行する方式。
基本概念,構文 (シンタックス),プログラミング言語における記述のルール。
基本概念,バイナリ,コンピュータが直接理解できる0と1のデータ形式。
基本概念,アセンブラ,機械語と1対1で対応する低水準言語。
データ操作,変数,データを一時的に保存しておくための名前付きの箱。
データ操作,定数,一度代入すると後から値を変更できない変数。
データ操作,データ型,数値、文字列、真偽値など、データの種類。
データ操作,整数型 (int),小数点を含まない数値のデータ型。
データ操作,浮動小数点型 (float/double),小数点を含む数値のデータ型。
データ操作,文字列型 (string),テキスト（文字の連なり）を扱うデータ型。
データ操作,真偽値型 (boolean),「真 (true)」か「偽 (false)」の2値のみを持つ型。
データ操作,配列 (array),複数のデータを順番に並べて管理するデータ構造。
データ操作,リスト,配列に似ているが、要素の追加や削除が柔軟なデータ構造。
データ操作,連想配列 (ハッシュ/辞書),キーと値のペアでデータを管理する構造。
データ操作,ヌル (null/None),「値が存在しない」ことを示す特別な状態。
データ操作,キャスト,データの型を別の型に強制的に変換すること。
制御構造,条件分岐 (if文),条件によって実行する処理を分ける仕組み。
制御構造,ループ (for/while文),特定の処理を指定回数や条件を満たすまで繰り返すこと。
制御構造,無限ループ,終了条件が満たされず、永遠に繰り返されてしまう状態。
制御構造,演算子,足し算(+)や比較(==)など、計算や判定を行う記号。
制御構造,代入,変数に値を入れること。
制御構造,論理演算,AND(かつ)、OR(または)、NOT(否定)を用いた条件判定。
制御構造,スコープ,変数が有効な（参照できる）範囲。
制御構造,グローバル変数,プログラムのどこからでも参照できる変数。
制御構造,ローカル変数,特定の関数やブロック内でのみ有効な変数。
プログラム構成,関数 (メソッド),特定の処理をひとまとめにして名前をつけた単位。
プログラム構成,引数 (ひきすう),関数を呼び出す際に外から渡すデータ。
プログラム構成,戻り値 (返り値),関数が処理を終えた後に呼び出し元に返す結果。
プログラム構成,再帰,関数の中で自分自身を呼び出す手法。
プログラム構成,モジュール,プログラムを機能単位で分割した部品。
プログラム構成,ライブラリ,再利用可能な便利なプログラムを集めたファイル群。
プログラム構成,パッケージ,複数のモジュールをフォルダ構造などでまとめたもの。
プログラム構成,フレームワーク,開発の土台となる、特定のルールに沿った枠組み。
プログラム構成,API,外部のプログラム機能を利用するための窓口・規約。
オブジェクト指向,クラス,オブジェクトを作るための「設計図」や「型」。
オブジェクト指向,インスタンス,クラス（設計図）から実体として生成されたもの。
オブジェクト指向,オブジェクト,データと処理をひとまとめにした実体。
オブジェクト指向,プロパティ (フィールド),オブジェクトが持つ属性（データ）。
オブジェクト指向,メソッド,オブジェクトが行う振る舞い（処理）。
オブジェクト指向,コンストラクタ,インスタンス生成時に自動で実行される初期化処理。
オブジェクト指向,継承 (インヘリタンス),あるクラスの機能を引き継いで新しいクラスを作ること。
オブジェクト指向,カプセル化,データや内部処理を隠し、外部から直接触らせないこと。
オブジェクト指向,ポリモーフィズム (多態性),同じ名前のメソッドでも、状況に応じた動きをすること。
オブジェクト指向,インターフェース,クラスが実装すべきメソッドの構成を定義したもの。
オブジェクト指向,抽象クラス,共通の機能を定義し、継承されることを前提としたクラス。
開発環境・ツール,IDE,統合開発環境。コード作成、実行、デバッグができるソフト。
開発環境・ツール,テキストエディタ,プログラムを書くための文字編集ソフト（VS Codeなど）。
開発環境・ツール,デバッガ,バグを見つけ出すために動作を追跡するツール。
開発環境・ツール,ブレークポイント,デバッグ時にプログラムを一時停止させる箇所。
開発環境・ツール,コンソール (ターミナル),文字入力でコンピュータに命令を出す画面。
開発環境・ツール,環境変数,OS全体で共有される設定情報（パスの指定など）。
開発環境・ツール,Git,プログラムの変更履歴を記録するバージョン管理システム。
開発環境・ツール,リポジトリ,Gitで管理されたコードや履歴の貯蔵庫。
開発環境・ツール,コミット,変更内容を履歴としてリポジトリに記録すること。
開発環境・ツール,ブランチ,本番の履歴から枝分かれして個別に作業する仕組み。
開発環境・ツール,マージ,枝分かれした変更を一つに統合すること。
開発環境・ツール,プルリクエスト,変更内容を確認してもらうよう他者に依頼すること。
開発環境・ツール,パッケージマネージャー,ライブラリの導入や更新を自動管理するツール。
不具合・テスト,バグ,プログラムに含まれる論理的な間違いや欠陥。
不具合・テスト,デバッグ,バグの原因を特定して修正する作業。
不具合・テスト,例外 (エクセプション),実行中に発生する予期せぬエラー。
不具合・テスト,例外処理 (try-catch),エラーが起きても停止させずに対処する仕組み。
不具合・テスト,ユニットテスト,関数の最小単位が正しく動くか確認するテスト。
不具合・テスト,テストコード,テスト自体を自動で行うためのプログラム。
不具合・テスト,アサーション,プログラムが想定通りか確認するための判定式。
不具合・テスト,ドライバ,テスト対象を動かすための呼び出し用プログラム。
不具合・テスト,スタブ,テスト対象から呼び出される代わりの偽プログラム。
言語・パラダイム,静的型付け,実行前にデータの型を厳密に決める方式（Javaなど）。
言語・パラダイム,動的型付け,実行時にデータの型を柔軟に決める方式（Pythonなど）。
言語・パラダイム,強型付け,型変換を厳格に行い、曖昧な動作を許さない性質。
言語・パラダイム,コンパイル言語,実行前に翻訳が必要な言語（C++, Goなど）。
言語・パラダイム,スクリプト言語,書いたコードをすぐに実行できる言語（Ruby, PHPなど）。
言語・パラダイム,マークアップ言語,文書の構造を指定する言語（HTML, XMLなど）。
言語・パラダイム,スタイルシート言語,見た目を整えるための言語（CSS）。
言語・パラダイム,関数型プログラミング,状態変化を避け、関数の組み合わせで構築する手法。
言語・パラダイム,宣言的プログラミング,「どうやるか」ではなく「何であるか」を記述する手法。
コーディング手法,リファクタリング,動作を変えずにコードを読みやすく整理すること。
コーディング手法,インデント,コードの階層を分かりやすくするための字下げ（空白）。
コーディング手法,コメントアウト,プログラムとして実行されないメモ書き。
コーディング手法,命名規則,変数や関数の名前の付け方のルール。
コーディング手法,キャメルケース,単語の区切りを大文字にする命名法（userName）。
コーディング手法,スネークケース,単語をアンダーバーで繋ぐ命名法（user_name）。
コーディング手法,DRY原則,「同じことを繰り返さない」というプログラミングの鉄則。
コーディング手法,ハードコーディング,設定値などをコード内に直接書き込んでしまうこと。
コーディング手法,ボイラープレート,何度も書く必要があるお決まりの定型文。
コーディング手法,マジックナンバー,意味が不明なまま直接書かれた数値。
非同期・並列処理,スレッド,プログラムを実行する最小の処理単位。
非同期・並列処理,マルチスレッド,複数の処理を同時に並行して行うこと。
非同期・並列処理,非同期処理,ある処理の完了を待たずに次の処理を進めること。
非同期・並列処理,コールバック,処理が終わった後に実行されるよう指定された関数。
非同期・並列処理,Promise/async-await,非同期処理を読みやすく書くための仕組み。
非同期・並列処理,デッドロック,複数の処理がお互いのロック解除を待ち合って停止する状態。
データベース,DBMS,データベースを管理・運用するための専用ソフトウェア。
データベース,RDB,データを表形式（テーブル）で管理するリレーショナルデータベース。
データベース,SQL,RDBの操作（抽出、挿入、更新、削除）を行うための言語。
データベース,テーブル,行と列で構成される、データを格納する表。
データベース,レコード (行),テーブル内の一件分のデータ。
データベース,カラム (列),データ項目（名前、年齢など）の単位。
データベース,主キー (プライマリキー),レコードを一意に識別するための重複しない項目。
データベース,外部キー,別のテーブルとデータを関連付けるための項目。
データベース,インデックス,データの検索速度を高速化するための索引。
データベース,クエリ,データベースに対して情報の操作を依頼する命令。
データベース,正規化,データの重複をなくし、矛盾が起きないように整理する作業。
データベース,トランザクション,複数の処理を「すべて成功」か「すべて失敗」のひとまとめにする単位。
データベース,コミット,トランザクションの結果を確定させ、保存すること。
データベース,ロールバック,エラー時にトランザクション前の状態に引き戻すこと。
データベース,NoSQL,表形式にとらわれない、拡張性の高いデータベースの総称。
データベース,ストアドプロシージャ,よく使う一連の処理をデータベース側に保存しておく仕組み。
データベース,ビュー,複雑なクエリの結果を、仮想的なテーブルとして定義したもの。
データベース,排他制御,複数のユーザーが同時に同じデータを書き換えないように制限する仕組み。
データベース,デッドロック,複数の処理がお互いにロック解除を待ち合って停止する状態。
データベース,マイグレーション,データベースの構造（スキーマ）を変更・移行すること。
その他,エスケープ処理,特別な意味を持つ記号を、ただの文字として扱う処理。
その他,正規表現,文字列のパターンを記号で表現する特殊な記述法。
その他,依存関係,あるプログラムが別のライブラリを必要としている状態。
その他,SDK,特定の開発を行うために必要なツールが一式入った開発キット。
その他,ポインタ,メモリ上の住所（アドレス）を直接指し示す変数の型。
その他,ガベージコレクション,使わなくなったメモリを自動で解放する仕組み。
その他,スタックオーバーフロー,メモリの限界を超えてプログラムが異常終了すること。
